{
  "$schema": "../plan-structures/self-funded-mec/basic-mec/plan-docs/self-funded-mec-plan-document-context.schema.json",
  "schemaVersion": "1.3.0",
  "sponsor": {
    "id": "sponsor.example-company",
    "legalName": "Example Company, Inc.",
    "ein": "12-3456789",
    "address": {
      "line1": "100 Main Street",
      "line2": "Suite 200",
      "city": "Columbus",
      "region": "OH",
      "postalCode": "43215",
      "countryCode": "US",
      "formatted": "100 Main Street, Suite 200, Columbus, OH 43215"
    },
    "participatingEmployers": []
  },
  "plan": {
    "id": "plan.example-company-welfare",
    "name": "Example Company CommonCare Welfare Benefit Plan",
    "erisaPlanNumber": "501",
    "originalEffectiveDate": "2027-01-01",
    "effectiveDate": "2027-01-01",
    "year": {
      "startDate": "2027-01-01",
      "endDate": "2027-12-31"
    },
    "document": {
      "id": "plan-document.core.example-company-welfare",
      "version": "2.0",
      "status": "adopted",
      "owner": "Example Company, Inc."
    }
  },
  "administration": {
    "planAdministrator": {
      "name": "Example Company, Inc.",
      "address": {
        "line1": "100 Main Street",
        "line2": "Suite 200",
        "city": "Columbus",
        "region": "OH",
        "postalCode": "43215",
        "countryCode": "US",
        "formatted": "100 Main Street, Suite 200, Columbus, OH 43215"
      },
      "contact": {
        "email": "benefits@example.com",
        "phone": "(555) 555-0100",
        "formatted": "benefits@example.com; (555) 555-0100"
      }
    },
    "agentForServiceOfProcess": {
      "name": "Example Company, Inc.",
      "address": {
        "line1": "100 Main Street",
        "line2": "Suite 200",
        "city": "Columbus",
        "region": "OH",
        "postalCode": "43215",
        "countryCode": "US",
        "formatted": "100 Main Street, Suite 200, Columbus, OH 43215"
      }
    },
    "namedFiduciary": {
      "name": "Example Company, Inc."
    },
    "serviceContacts": {
      "eligibility": { "email": "benefits@example.com", "phone": "(555) 555-0100", "formatted": "benefits@example.com; (555) 555-0100" },
      "claims": { "email": "claims@example.com", "phone": "(555) 555-0101", "formatted": "claims@example.com; (555) 555-0101" },
      "appeals": { "email": "appeals@example.com", "phone": "(555) 555-0102", "formatted": "appeals@example.com; (555) 555-0102" },
      "providerNavigation": { "email": "navigation@example.com", "phone": "(555) 555-0103", "formatted": "navigation@example.com; (555) 555-0103" },
      "continuation": { "email": "cobra@example.com", "phone": "(555) 555-0104", "formatted": "cobra@example.com; (555) 555-0104" },
      "privacy": { "email": "privacy@example.com", "phone": "(555) 555-0105", "formatted": "privacy@example.com; (555) 555-0105" }
    },
    "materialServiceProviders": []
  },
  "eligibility": {
    "defaultClass": {
      "id": "class.full-time-employees",
      "description": "All common-law employees regularly scheduled to work at least 30 hours per week"
    },
    "defaultWaitingPeriod": {
      "description": "Coverage begins on the first day of the month following 30 days of employment"
    },
    "enrollmentProcedure": "Enroll through the Employer's benefits enrollment system during the stated initial or annual enrollment period.",
    "coverageTermination": "Coverage ordinarily ends on the last day of the month in which eligibility ends, subject to the applicable Benefit Appendix and continuation rights.",
    "rehireRule": "An Employee rehired within 30 days resumes the elections in effect immediately before termination when the applicable coverage can be reinstated; a later rehire is administered as a new eligibility event unless law or a Benefit Appendix requires otherwise.",
    "leaveRule": "Coverage and contribution collection during an approved leave are administered under the Employer's leave procedures and applicable FMLA and USERRA restoration requirements."
  },
  "cafeteriaPlan": {
    "isEstablished": true,
    "documentId": "plan-document.cafeteria-plan.example-company",
    "electionPeriod": "The Plan Year, with initial and annual elections made before coverage begins.",
    "midyearElectionProcedure": "Request a permitted prospective election change through the Employer's benefits enrollment system within the period stated in the cafeteria plan."
  },
  "enrollmentSchedule": {
    "documentId": "enrollment-schedule.example-company",
    "name": "Example Company Benefits Enrollment Schedule",
    "description": "The enrollment schedule applicable to the Participant's eligible class, coverage period, age, location, and elected coverage.",
    "deliveryMethod": "Available in the Employer's benefits enrollment system and provided with the applicable enrollment materials."
  },
  "benefits": [
    {
      "id": "benefit.self-funded-basic-mec",
      "name": "Self-Funded Basic MEC",
      "documentId": "plan-document.benefit-appendix.self-funded-basic-mec",
      "version": "1.0",
      "effectiveDate": "2027-01-01",
      "terminationDate": null,
      "status": "adopted",
      "participantSummary": "Employee-only preventive coverage delivered through approved providers; it is not comprehensive major medical coverage.",
      "fundingDescription": "Self-funded by the Employer and paid from its general assets."
    }
  ],
  "spd": {
    "documentId": "spd.example-company-welfare-2027",
    "version": "1.0",
    "issueDate": "2026-12-15",
    "audience": "Employees and other persons eligible for benefits under the Plan",
    "howToUse": "Read the common information in this SPD together with the benefit section for each coverage in which you enroll.",
    "statementOfErisaRightsApplies": true
  },
  "adoption": {
    "method": "platform",
    "recordId": "adoption.example-2027-plan",
    "acceptedAt": "2026-12-15T15:00:00Z",
    "acceptedBy": {
      "userId": "user.example-authorized-sponsor",
      "name": "Jordan Example",
      "title": "Chief Executive Officer"
    }
  },
  "extensions": {
    "alternativeCompanion": {
      "document": { "version": "1.0", "effectiveDate": "2027-01-01" },
      "marketplaceOperator": "CommonCare",
      "marketplaceContact": "support@example.com; (555) 555-0110",
      "postTaxPayrollAvailable": true,
      "monthlyUnrestrictedTaxableAllowance": 150,
      "employerSponsoredPlanDescription": "The benefits listed in Appendix B of the CommonCare Welfare Benefit Plan",
      "acknowledgmentDeadline": "Before the first payroll deduction or direct payment"
    },
    "choiceIchra": {
      "document": { "version": "1.0", "appendixNumber": "ICHRA-1", "effectiveDate": "2027-01-01" },
      "eligibleClass": "All full-time salaried Employees in the adopted ICHRA class",
      "monthlyEmployerContribution": 400,
      "contributionVariation": "Amount varies only by participant age and family size under the adopted contribution schedule",
      "permittedExpenses": "Individual health insurance premiums and other Code section 213(d) medical expenses",
      "claimsRunoutDays": 90,
      "operationalSchedules": []
    },
    "commonFunded": {
      "document": { "version": "1.0", "effectiveDate": "2027-01-01" },
      "majorMedicalCoverage": {
        "name": "Example Major Medical Coverage",
        "documentId": "plan-document.benefit-appendix.example-major-medical",
        "coverageType": "self-funded"
      },
      "commonFunds": {
        "name": "CommonFunds",
        "documentId": "plan-document.benefit-appendix.common-funds"
      },
      "annexedCommonFundsDocuments": [
        { "name": "CommonFunds Coordinated Benefit Appendix", "documentId": "plan-document.benefit-appendix.common-funds" },
        { "name": "CommonFunds Health FSA Component", "documentId": "plan-document.component.common-funds-health-fsa" },
        { "name": "CommonFunds Excepted Benefit HRA Component", "documentId": "plan-document.component.common-funds-ebhra" }
      ],
      "allocationObjective": "Coordinate lower-premium major medical coverage with CommonFunds amounts available for eligible Participant expenses.",
      "bandingDescription": "Allowance amounts may be adjusted by Participant age and applicable insurance rating area as shown in the Enrollment Schedule and permitted by the underlying coverage rules."
    },
    "commonFunds": {
      "document": { "version": "1.0", "appendixNumber": "CF-1", "effectiveDate": "2027-01-01" },
      "pathway": "excepted",
      "groupCoverage": {
        "isOffered": true,
        "documentId": "plan-document.benefit-appendix.self-funded-basic-mec",
        "description": "Self-Funded Basic MEC",
        "isNonExcepted": true
      },
      "allocation": {
        "monthlyEmployerOnlyAmount": 200,
        "monthlyHealthOnlyFlexCredit": 100,
        "monthlyCashableFlexCredit": 100,
        "annualDirectEmployeeFsaElection": 1000,
        "priorityRule": "Allocate genuinely Employer-only amounts to the EBHRA up to its limit, then allocate valid Employer Health FSA funding; treat cashable amounts elected into the Health FSA as salary reduction."
      },
      "deductible": {
        "enabled": true,
        "appliesToHealthFsa": true,
        "appliesToHra": true,
        "amountSource": "enrollment-schedule",
        "enrollmentScheduleReference": "The deductible shown for the Participant's CommonFunded election in the applicable Enrollment Schedule",
        "accumulationRule": "Individual deductible; eligible expenses incurred by the Participant accumulate during the coverage period.",
        "creditedExpenses": "Expenses credited by the major medical coverage toward its in-network deductible, plus any additional eligible expenses expressly identified in the Enrollment Schedule.",